{
  "id": "RLT-SHARED-COLOUR-CHARACTER",
  "code": "shared-colour-character",
  "label": "Shared colour character",
  "inverseLabel": "Shared colour character",
  "category": "seasonal-expression",
  "directionality": "symmetric",
  "description": "Connects cultivars with a material shared seasonal colour character while retaining seasonal and environmental qualifications.",
  "allowedNodePairs": [
    "cultivar:cultivar"
  ],
  "evidenceRequired": true,
  "status": "approved",
  "version": "1.0.0",
  "generatedFrom": {
    "path": "atlas-repository/relationship-standards/relationship-types.json",
    "sha256": "60de9e4280234ba499f84b0b79c0c865dfe5d84574011cbeb2537908a4de4847",
    "compilerVersion": "1.2.0"
  }
}
