{
  "id": "RLT-DIAGNOSTIC-COMPARISON",
  "code": "diagnostic-comparison",
  "label": "Diagnostic comparison",
  "inverseLabel": "Diagnostic comparison",
  "category": "diagnosis",
  "directionality": "symmetric",
  "description": "Connects cultivars selected for explicit comparative teaching or identification context. This relation supports comparison and never authenticates a specimen by itself.",
  "allowedNodePairs": [
    "cultivar:cultivar"
  ],
  "evidenceRequired": true,
  "status": "approved",
  "version": "1.0.0",
  "generatedFrom": {
    "path": "atlas-repository/relationship-standards/relationship-types.json",
    "sha256": "60de9e4280234ba499f84b0b79c0c865dfe5d84574011cbeb2537908a4de4847",
    "compilerVersion": "1.2.0"
  }
}
